{
  "agent_id": "hri-5bc1056da0d3598bb975a212b0e573c4",
  "binding_id": "bind-dcf4d1bfe8049b25d12214141b2a646de3889349fe6bb2376ad8a4219ce42dff",
  "expires_at": "2026-09-14T13:41:46.548160248Z",
  "identity_id": "ri-495dea0727cd15885ffa78acba336147",
  "intent_id": "int-ri-f4bc30d587311c347c3da9d7fd5b8db6b64c68ad1ab16bb7481ce836ef76368c",
  "platform": "hermes",
  "schema_version": "local-runtime-session-enrolled/v1",
  "session_id": "r01-sec-live-session-2"
}